{
  "$schema": "http://json-schema.org/draft-07/schema#",
  "$id": "skill-manifest",
  "type": "object",
  "required": ["name", "description", "version", "action_risk"],
  "additionalProperties": false,
  "properties": {
    "name": { "type": "string", "minLength": 1 },
    "description": { "type": "string", "minLength": 1 },
    "version": { "type": "string", "minLength": 1 },
    "action_risk": {
      "oneOf": [
        {
          "type": "string",
          "enum": ["none", "low", "medium", "high", "critical"]
        },
        {
          "type": "integer",
          "minimum": 0,
          "maximum": 100
        }
      ]
    },
    "sensitivity": {
      "type": "string",
      "enum": ["normal", "elevated"]
    },
    "inputs": {
      "type": "object",
      "additionalProperties": { "type": "string" }
    },
    "outputs": {
      "type": "object",
      "additionalProperties": { "type": "string" }
    },
    "permissions": {
      "type": "array",
      "items": { "type": "string" }
    },
    "secrets": {
      "type": "array",
      "items": { "type": "string" }
    },
    "timeout": { "type": "integer", "minimum": 1 },
    "capabilities": {
      "type": "array",
      "items": { "type": "string" }
    },
    "entity_enrichment": {
      "type": "object",
      "required": ["param", "default"],
      "additionalProperties": false,
      "properties": {
        "param": { "type": "string", "minLength": 1 },
        "default": { "type": "string", "enum": ["caller", "agent"] }
      }
    },
    "allowed_callers": {
      "type": "array",
      "items": { "type": "string", "minLength": 1 },
      "description": "Agent names allowed to invoke this skill. Omit for unrestricted access. 'system' is a reserved name for system-layer invocations."
    },
    "install": {
      "type": "object",
      "additionalProperties": false,
      "properties": {
        "requires_secrets": {
          "type": "array",
          "items": { "type": "string", "minLength": 1 },
          "description": "Vault secret keys this skill needs configured before it can be installed or enabled."
        }
      }
    },
    "uninstall": { "type": "object" }
  }
}
