{
  "name": "contact-unlink-identity",
  "description": "Remove a channel identity from a contact. Use when the principal says an email/phone is wrong or no longer valid for a contact.",
  "version": "1.0.1",
  "sensitivity": "normal",
  "action_risk": "low",
  "inputs": {
    "contact_id": "string",
    "identity_id": "string"
  },
  "outputs": {
    "removed": "boolean"
  },
  "permissions": [],
  "secrets": [],
  "timeout": 10000
}
