{
  "name": "contact-grant-permission",
  "description": "Grant or deny a specific permission for a contact, overriding their role defaults. Use when the CEO says 'Let X do Y' or 'Don't let X do Y'.",
  "version": "1.1.0",
  "sensitivity": "normal",
  "action_risk": "critical",
  "inputs": {
    "contact_id": "string",
    "permission": "string",
    "granted": "boolean"
  },
  "outputs": {
    "contact_id": "string",
    "permission": "string",
    "granted": "boolean"
  },
  "permissions": [],
  "secrets": [],
  "timeout": 10000
}
