{
  "name": "doc-write",
  "description": "Write to the OKF document workspace. Modes: `create` (new document — requires `type`, optional `body`/`frontmatter`), `append` (add content — requires `content` + `expected_version`), `replace` (swap full body — requires `body` + `expected_version`), `section-edit` (replace a `##` section's body — requires `section`, `content`), `section-delete` (remove a `##` section and its heading — requires `section`; errors if missing). Section modes take optional `expected_section_version`. Each write appends to the directory's `log.md`. On version mismatch returns `conflict: true` with the latest versions — re-read and retry. **Retention:** `/projects/…` is durable. `/scratch/<conversation-id>/…` is ephemeral — omit `ttl_days` for the scratch TTL, `ttl_days: <n>` overrides, `0` opts out. `ttl_days` elsewhere is ignored (returns a `retention_warning`).",
  "version": "0.5.0",
  "sensitivity": "normal",
  "action_risk": "low",
  "inputs": {
    "path": "string",
    "mode": "string (create | append | replace | section-edit | section-delete)",
    "type": "string? (required for create — OKF frontmatter type)",
    "body": "string? (required for replace; optional for create)",
    "content": "string? (required for append and section-edit)",
    "frontmatter": "object? (optional YAML frontmatter fields except type; `ttl_days` controls scratch retention — omit to inherit default, 0 to opt out)",
    "section": "string? (required for section modes — `##` heading)",
    "expected_version": "number? (required for append/replace — from last doc-read)",
    "expected_section_version": "number? (optional for section modes)",
    "summary": "string? (one-line description for log.md — defaults to mode + path)",
    "task_id": "string? (optional — defaults to the project-root task id of the bound task)",
    "conversation_id": "string? (optional association)"
  },
  "outputs": {
    "action": "string? (created | appended | replaced | section-edited | section-deleted)",
    "document": "object? (written document metadata on success)",
    "conflict": "boolean? (true when optimistic concurrency failed)",
    "path": "string?",
    "version": "number?",
    "section_versions": "object?",
    "updated_at": "string?",
    "displayTimezone": "string?",
    "retention_warning": "string? (when ttl_days is set on a non-scratch path)"
  },
  "permissions": [],
  "secrets": [],
  "timeout": 30000,
  "capabilities": ["workingDocs", "taskRepo", "agentRegistry"]
}
