{
  "name": "calendar-holds-sweep",
  "description": "Recurring maintenance: delete tentative calendar holds (curia-hold metadata) whose slot is already in the past or whose created-at exceeds the max hold age (default 7 days). Operates only on Curia-created holds with no attendees; sends no notifications. Intended to be run on a schedule by the calendar specialist.",
  "version": "0.1.3",
  "sensitivity": "normal",
  "action_risk": "low",
  "install": { "requires_secrets": ["nylas_api_key", "ceo_nylas_grant_id"] },
  "inputs": {
    "contactId": "string (UUID — whose calendars to sweep; pass the principal's contact ID as given in your system prompt)",
    "maxAgeDays": "number? (default 7 — holds older than this by created-at are expired)"
  },
  "outputs": {
    "scanned": "number (curia-hold events examined)",
    "expired": "number (holds successfully deleted)",
    "failed": "number (stale holds where deleteEvent threw — e.g. revoked grant; 0 on a clean run)",
    "calendarErrors": "number (calendars whose listEvents threw and were skipped; 0 on a clean run)"
  },
  "permissions": [],
  "secrets": [],
  "timeout": 30000,
  "capabilities": [
    "nylasCalendarClient"
  ],
  "allowed_callers": [
    "calendar"
  ]
}
