{
  "name": "ceo-inbox-list",
  "description": "List recent messages from the principal's personal email inbox. Intended for use by the ceo-inbox agent — accesses the principal's personal email, do not call from other agents.",
  "version": "0.5.1",
  "sensitivity": "normal",
  "action_risk": "none",
  "inputs": {
    "limit": "number? (max messages to return, 1–50, default 20)",
    "folder": "string? (Gmail folder/label to list, default 'INBOX'; use 'SENT' for the Sent folder, or 'DRAFTS' to list unsent drafts)",
    "unread_only": "boolean? (if true, only return unread messages, default true; ignored for DRAFTS)"
  },
  "outputs": {
    "messages": "array of { id, threadId, from, to, cc, subject, date, snippet, unread, folders, attachments: [{ id, filename, contentType, size, isCalendarInvite? }] } (for non-draft folders)",
    "drafts": "array of { id, threadId, subject, to, cc, snippet, date } (returned instead of messages when folder is DRAFTS, alongside folder: 'DRAFTS')",
    "count": "number of items returned",
    "has_more": "boolean — true when more unread messages remain beyond this batch (lets the caller drain the inbox in batches); absent for DRAFTS"
  },
  "permissions": [],
  "secrets": ["nylas_api_key", "ceo_nylas_grant_id", "nylas_self_email"],
  "timeout": 20000,
  "capabilities": []
}
