{
  "name": "web-browser",
  "description": "Control a real web browser to interact with JS-rendered pages, fill forms, navigate multi-step flows, and interact with sites that have no API. Use this instead of web-fetch when a page requires JavaScript, login, or user interaction. Each call performs one action and returns the updated page state (including content inside iframes, labelled '--- Frame: ... ---'). Pass session_id back on subsequent calls to maintain browser context across actions. Actions: navigate (url required), click (selector required), type (selector + either text OR secret_ref), select (selector+value required), scroll (optional selector — scrolls that element into view, else scrolls the viewport down), hover (selector required — reveals hover-only menus/date cells), press_key (key required — e.g. Enter, Tab, ArrowRight, Escape; for calendar/combobox keyboard nav), wait_for (selector required — waits up to 10s for an element to render; use this for heavy widgets like date pickers that load after the page), get_content, screenshot, close_session. The page state lists interactable elements as '[gNfNeM] role \"name\"' under '--- Interactable elements ---'; prefer that gNfNeM ref as your selector (with or without the surrounding brackets — both resolve) — it targets exactly one element, so it is the reliable way to pick one option among duplicates (e.g. a survey row's repeated 'Agree'). A ref stays valid across later actions as long as its element is still on the page, so you can read once and act on several. Selectors that are not a ref still resolve by accessible role/label/text and aria-label and reach into iframes automatically; fall back to describing the element only when no ref fits (e.g. an element that appeared after the last snapshot). If an action reports that a ref is stale (the element is gone or the page re-rendered), call get_content to get fresh refs and use those — do not retry the old ref. If a click reports the target is covered or intercepted by another element (a sticky header/footer, cookie banner, ad, or modal sits over it), the browser auto-recenters and retries once; if it still fails, scroll the page or dismiss the blocking element (close the banner/modal), then retry. If several actions fail in a row the session may refuse further interactions (click/type/select/hover/wait_for) — get_content to re-read and recover, or hand off. Custom-styled widgets often hide the native input, and nearby visible caption text is frequently decorative rather than the clickable target. If a heavy widget (e.g. a date picker) seems missing, wait_for it before clicking. To fill a stored credential into a form, pass secret_ref (a user.* secret name) instead of text — the value is filled server-side and never shown to you. If navigate returns 'Site blocked automated access', the site refuses automation from the server; do not retry — hand off to the principal or draft the request instead. Set block_ads:true ONLY for plain content browsing — never for login, authenticated, or form-fill flows (sites flag the ad blocker as a privacy extension). Set incognito:true to run in a throwaway, isolated session (e.g. logging in as Curia itself) instead of the principal's persistent profile; omit it for the principal's own accounts so sessions persist. On bot-protected sites, prefer real UI interaction over injected fetch(). After navigate, the browser waits for Cloudflare-style challenge pages to clear automatically.",
  "version": "1.7.0",
  "sensitivity": "normal",
  "action_risk": "medium",
  "inputs": {
    "action": "string",
    "url": "string?",
    "selector": "string?",
    "text": "string?",
    "value": "string?",
    "key": "string?",
    "secret_ref": "string?",
    "session_id": "string?",
    "screenshot": "boolean?",
    "block_ads": "boolean?",
    "incognito": "boolean?"
  },
  "outputs": {
    "content": "string",
    "session_id": "string",
    "url": "string",
    "screenshot_base64": "string?",
    "screenshot_skipped": "string?"
  },
  "permissions": [
    "network:https"
  ],
  "secrets": [],
  "timeout": 30000,
  "capabilities": [
    "browserService",
    "secretResolver"
  ],
  "allowed_callers": ["coordinator"]
}
