{
  "name": "contact-lookup",
  "description": "Look up a contact by name, role, or channel identifier. Returns matching contacts with their details.",
  "version": "1.0.0",
  "sensitivity": "normal",
  "action_risk": "none",
  "inputs": {
    "query": "string (for name: a name or partial name; for channel: format as 'channel:identifier' e.g. 'email:jenna@acme.com')",
    "by": "string (name | role | channel)"
  },
  "outputs": {
    "contacts": "array",
    "count": "number"
  },
  "permissions": [],
  "secrets": [],
  "timeout": 15000
}
