{
  "name": "contact-revoke-permission",
  "description": "Remove a permission override for a contact, restoring their role's default behavior for that permission.",
  "version": "1.1.0",
  "sensitivity": "normal",
  "action_risk": "critical",
  "inputs": {
    "contact_id": "string",
    "permission": "string"
  },
  "outputs": {
    "contact_id": "string",
    "permission": "string",
    "revoked": "boolean"
  },
  "permissions": [],
  "secrets": [],
  "timeout": 10000
}
